{
  "schemaVersion": 1,
  "id": "code-runtime-ts",
  "source": "dsh",
  "displayName": "Code Runtime (TypeScript)",
  "description": "The execution environment behind run_code for PTC mode: each program runs in one fresh worker thread with an empty environment, heap cap, and hard termination. Containment, not a security boundary; bash-equivalent trust by design.",
  "descriptionZh": "PTC 模式 run_code 的执行环境：每个程序在全新 worker 线程中运行，空环境、堆上限、硬终止。这是隔离而非安全边界，信任级别等同 bash。",
  "author": {
    "name": "DeepSeek AI",
    "url": "https://github.com/deepseek-ai"
  },
  "links": {
    "repo": "https://github.com/deepseek-ai/deepseek-harness/tree/master/packages/code-runtime",
    "docs": "https://github.com/deepseek-ai/deepseek-harness/blob/master/packages/code-runtime/README.md"
  },
  "license": "MIT",
  "category": "tools",
  "status": "stable",
  "surfaces": {
    "server": {}
  },
  "provides": {
    "tools": [
      "run_code"
    ]
  },
  "install": {
    "rows": [
      {
        "id": "code-runtime",
        "name": "@deepseek-ai/dsh-code-runtime-worker-thread",
        "activation": "profile-patch",
        "npm": {
          "spec": "@deepseek-ai/dsh-code-runtime-worker-thread"
        }
      }
    ]
  },
  "capabilities": [
    "code-execution"
  ],
  "verified": {
    "at": "2026-09-04",
    "packages": [
      {
        "name": "@deepseek-ai/dsh-code-runtime-worker-thread",
        "version": "0.0.1-rc.3"
      }
    ]
  }
}
