{
  "schemaVersion": 1,
  "id": "sidechat",
  "source": "official",
  "displayName": "Sidechat",
  "description": "A side-chat panel on the dsh Web workbench for quick questions in a separate, memory-only session. Two packages: Workbench UI first, then Sidechat itself.",
  "descriptionZh": "dsh Web 工作台侧边的快速问答面板，使用独立的内存会话。两包安装：先 Workbench UI，再 Sidechat。",
  "author": { "name": "Ephemeral AI Lab", "url": "https://github.com/Ephemeral-AI-Lab" },
  "links": {
    "repo": "https://github.com/Ephemeral-AI-Lab/dsh-plugins/tree/main/plugins/sidechat",
    "docs": "https://github.com/Ephemeral-AI-Lab/dsh-plugins/blob/main/plugins/sidechat/README.md"
  },
  "license": "MIT",
  "category": "ui",
  "status": "beta",
  "surfaces": { "server": {}, "web": { "clientModule": true } },
  "provides": {},
  "install": {
    "rows": [
      {
        "id": "workbench-ui",
        "name": "dsh-workbench-ui",
        "github": { "repo": "Ephemeral-AI-Lab/dsh-plugins", "ref": "main", "subdir": "plugins/work-bench-ui" }
      },
      {
        "id": "sidechat",
        "name": "dsh-sidechat",
        "github": { "repo": "Ephemeral-AI-Lab/dsh-plugins", "ref": "main", "subdir": "plugins/sidechat" }
      }
    ]
  },
  "capabilities": ["session-write"],
  "verified": {
    "at": "2026-09-04",
    "packages": [
      { "name": "dsh-workbench-ui", "version": "0.1.0" },
      { "name": "dsh-sidechat", "version": "0.1.0" }
    ]
  }
}
