{
  "schemaVersion": 1,
  "id": "dsh-ollama-cloud-provider",
  "source": "community",
  "displayName": "Ollama Cloud Provider",
  "description": "Adds Ollama Cloud model routing, account usage and balance queries to DeepSeek Harness.",
  "descriptionZh": "为 DeepSeek Harness 添加 Ollama Cloud 模型路由、账户用量和余额查询。",
  "author": {
    "name": "GooDAnDReaDY",
    "url": "https://github.com/GooDAnDReaDY"
  },
  "links": {
    "repo": "https://github.com/GooDAnDReaDY/dsh-ollama-cloud-provider",
    "docs": "https://github.com/GooDAnDReaDY/dsh-ollama-cloud-provider#readme",
    "npm": "https://www.npmjs.com/package/@goodandready/dsh-ollama-cloud-provider"
  },
  "license": "MIT",
  "category": "provider",
  "status": "stable",
  "surfaces": {
    "server": {},
    "web": {
      "clientModule": true
    }
  },
  "install": {
    "rows": [
      {
        "id": "dsh-ollama-cloud-provider",
        "name": "@goodandready/dsh-ollama-cloud-provider",
        "npm": {
          "spec": "@goodandready/dsh-ollama-cloud-provider@0.1.14"
        }
      }
    ]
  },
  "engines": {
    "node": ">=22",
    "dsh": "0.2.0-rc.2 || >=0.2.1-rc.2 <0.2.2-0"
  },
  "capabilities": [
    "network",
    "credentials",
    "fs-write"
  ],
  "verified": {
    "at": "2026-10-30",
    "packages": [
      {
        "name": "@goodandready/dsh-ollama-cloud-provider",
        "version": "0.1.14"
      }
    ]
  }
}
